{
  "schema_version": "1.0",
  "prompt_version": "followup-extraction:v1",
  "meeting_topic": "Test Data Status",
  "meeting_date": "11.09.2026",
  "project_name": null,
  "participants": [
    { "name": "Lena Hoffmann", "organisation": "BOREK" },
    { "name": "Markus Weber", "organisation": "Acme" }
  ],
  "key_points": [
    "Test invoices will be provided",
    "No deadline was named"
  ],
  "decisions": [],
  "action_items": [
    {
      "action": "Provide test invoices",
      "owner": "Markus Weber",
      "due": "TBD"
    }
  ],
  "open_questions": [],
  "next_meeting": null,
  "confidence": {
    "key_points": "high",
    "action_items": "high"
  },
  "review_flags": []
}
