{
  "schema_version": "1.0",
  "prompt_version": "followup-extraction:v1",
  "meeting_topic": "Next Steps Review",
  "meeting_date": "11.09.2026",
  "project_name": null,
  "participants": [
    { "name": "Lena Hoffmann", "organisation": "BOREK" },
    { "name": "Markus Weber", "organisation": "Acme" }
  ],
  "key_points": [
    "Email cannot list every next step",
    "Detail stays in the protocol"
  ],
  "decisions": [],
  "action_items": [
    {
      "action": "Provide test invoices",
      "owner": "Markus Weber",
      "due": "18.09.2026"
    },
    {
      "action": "Deliver interface specification",
      "owner": "Lena Hoffmann",
      "due": "19.09.2026"
    },
    {
      "action": "Open the firewall exception",
      "owner": "Markus Weber",
      "due": "20.09.2026"
    },
    {
      "action": "Share the sequence diagram",
      "owner": "Lena Hoffmann",
      "due": "21.09.2026"
    },
    {
      "action": "Book the UAT window",
      "owner": "Markus Weber",
      "due": "22.09.2026"
    }
  ],
  "open_questions": [],
  "next_meeting": null,
  "confidence": {
    "key_points": "high",
    "action_items": "high"
  },
  "review_flags": [
    "action_overflow_see_protocol"
  ]
}
