{
  "schema_version": "1.0",
  "prompt_version": "followup-extraction:v1",
  "meeting_topic": "Requirements Catch-up",
  "meeting_date": "11.09.2026",
  "project_name": null,
  "participants": [
    { "name": "Lena Hoffmann", "organisation": "BOREK" },
    { "name": "Markus Weber", "organisation": "Acme" }
  ],
  "key_points": [
    "Interface specification is still open",
    "No one committed to writing it today"
  ],
  "decisions": [],
  "action_items": [],
  "open_questions": [
    "Who will deliver the interface specification next week?"
  ],
  "next_meeting": null,
  "confidence": {
    "key_points": "high",
    "action_items": "high"
  },
  "review_flags": []
}
