{
  "schema_version": "1.0",
  "prompt_version": "followup-extraction:v1",
  "meeting_topic": "Requirements Workshop",
  "meeting_date": "11.09.2026",
  "project_name": null,
  "participants": [
    { "name": "Lena Hoffmann", "organisation": "BOREK" },
    { "name": "Markus Weber", "organisation": "Acme" }
  ],
  "key_points": [
    "Interface will be REST, not SOAP",
    "Pilot starts with invoice matching only",
    "Warehouse labelling stays out of scope"
  ],
  "decisions": [
    "REST is the agreed interface",
    "Pilot is invoice matching only"
  ],
  "action_items": [
    {
      "action": "Provide test invoices",
      "owner": "Markus Weber",
      "due": "18.09.2026"
    },
    {
      "action": "Deliver interface specification",
      "owner": "Lena Hoffmann",
      "due": "25.09.2026"
    }
  ],
  "open_questions": [],
  "next_meeting": null,
  "confidence": {
    "key_points": "high",
    "action_items": "high"
  },
  "review_flags": []
}
