{
  "schema_version": "1.0",
  "prompt_version": "followup-extraction:v1",
  "meeting_topic": "Interface Alignment",
  "meeting_date": "11.09.2026",
  "project_name": null,
  "participants": [
    { "name": "Lena Hoffmann", "organisation": "BOREK" },
    { "name": "Markus Weber", "organisation": "Acme" }
  ],
  "key_points": [
    "Interface specification is due next Friday"
  ],
  "decisions": [],
  "action_items": [
    {
      "action": "Deliver interface specification",
      "owner": "Lena Hoffmann",
      "due": "18.09.2026"
    }
  ],
  "open_questions": [],
  "next_meeting": null,
  "confidence": {
    "key_points": "high",
    "action_items": "high"
  },
  "review_flags": []
}
