{
  "schema_version": "1.0",
  "prompt_version": "followup-extraction:v1",
  "meeting_topic": "Follow-up Alignment",
  "meeting_date": "11.09.2026",
  "project_name": null,
  "participants": [],
  "key_points": [
    "Send the interface specification soon",
    "Test invoices are also needed"
  ],
  "decisions": [],
  "action_items": [],
  "open_questions": [
    "Who will send the interface specification?",
    "Who will provide the test invoices?"
  ],
  "next_meeting": null,
  "confidence": {
    "key_points": "low",
    "action_items": "low"
  },
  "review_flags": [
    "missing_speaker_labels",
    "unclear_action_owners",
    "key_points_low_confidence",
    "action_items_low_confidence"
  ]
}
